town,price,age,site_buy,date,id,id_cultural,name,img_url,content
Москва,400 — 800,6+,http://mosoblkino.ru/,1 февраля 2020,151,34,Детская сказка «Маленькая колдунья»,https://www.2do2go.ru/uploads/5fcb070b7f18a9e1ed9fb78164e38b25_w500_h500.jpeg,"История о большом желании Маленькой колдуньи попасть на праздник в Вальпургиеву ночь.  Главная героиня решает досконально изучить колдовскую науку и непременно стать настоящим профессионалом в этом нелегком деле. По мнению Маленькой колдуньи, она должна совершить как можно больше хороших поступков, и только тогда к ней придет заветное приглашение на торжество.  Режиссер: Екатерина Максимова. В главных ролях: Наталья Шклярук / Дарья Рябцева, Алексей Веретин / Андрей Чанцев, Марина Бояринова / Елена Цагина. По мотивам сказки О. Пройслера."
Москва,,6+,,7 января 2020,152,34,Спектакль «Сердце Земли»,https://www.2do2go.ru/uploads/3e68c997e88336f025523381afe0e682_w500_h500.jpeg,"Обыкновенные дети Маша и Вова, знакомые зрителям по спектаклям «Ларец с чудесами» и «Волшебное зеркало», отправляются на поиски украденного пиратами Сердца Земли. Ребятам придётся побывать в путешествии по космическим мирам, чтобы спасти родную планету. Премьера спектакля состоялась в 2018 г.  Рекомендуем приходить за 40 минут до начала спектакля для участия в анимационной программе. Вас ждут загадки, конкурсы, подвижные игры, новогодний хоровод, весёлая музыка и, конечно же, Дедушка Мороз со Снегурочкой. Вход по пригласительным."
Москва,1000 — 3600,6+,,21 марта 2020,153,35,Celtica,https://www.2do2go.ru/uploads/831e31b267bb3d2479ab8a72aec7414a_w500_h500.jpg,"Все знают, что День Святого Патрика в Москве отмечается широко и с размахом! В этом году к праздничным мероприятиям присоединится ирландское шоу Celtica, которое активно гастролирует по стране и дало уже больше 40 концертов!  Celtica – это настоящее знакомство с танцевальной и музыкальной культурой Ирландии. Фееричный коктейль из самобытных кельтских мелодий, фирменного ирландского степа, живой музыки и завораживающего пения солистов. Энергия движения, отточенность и синхронность, яркие костюмы и невероятные ритмы. Узнать подробности вы можете на <a target=""_blank"" href=""https://celticashow.ticketscloud.org/"">сайте.</a>"
Москва,,0+,,17 декабря 2019,154,35,Концерт Ирины Эмировой,https://www.2do2go.ru/uploads/1980eb98f9af4016aa067dc0162061f2_w500_h500.jpg,"Петербургская певица Ирина Эмирова поёт в жанре настоящей народной эстрады, который ныне почти вымер. Доступные жизненные тексты, открытая, естественная подача и тесный контакт со зрителем от первой минуты шоу до последней – вот что отличает её концерты. Ирина Эмирова не просто певица, автор и композитор, она – психолог с практически двадцатилетним стажем работы в этой области. Все её песни основаны на реальных событиях из жизни разных людей. Каждая песня – как короткометражный фильм о переживаниях определённого человека. Концерт, подобно нашей жизни, состоит из грустных и весёлых композиций. Любовь, надежда, вера в себя, чувства единства, прощения и принятия – всё это можно концентрированно прочувствовать и прожить в течение двухчасового концерта вместе с Ириной. Узнать подробности вы можете в группе <a target=""_blank"" href=""https://vk.com/irina_emirova"">VK</a>, на страницах <a target=""_blank"" href=""https://ok.ru/irinaemiro"">ОK</a> и <span style=""font-style:normal""><a target=""_blank"" href=""https://www.instagram.com/irina.emirova_official/"">Instagram</a>."
Москва,600 — 2200,6+,http://irishweek.ru/dance/,18 марта 2018,155,35,Dance Irish,https://www.2do2go.ru/uploads/4a879308c59d2a3bc28b0565c769ae2d_w500_h500.jpg,"Dance Irish 2018 – праздник музыки и танцев из самого сердца Ирландии! Раз в году в Москве на одной сцене собираются<b> </b>музыканты из Ирландии и труппа из лучших российских танцоров под руководством солистов Riverdance. В этом году на большую сцену ДК МИИТ выйдут: Третий год подряд Dance Irish знакомит зрителей с самыми яркими сторонами ирландской культуры, наполняя зал невероятной энергией ирландской музыки и поражая мастерством танцоров. Вас ждут специально поставленные танцевальные номера, лирические песни на английском и ирландском, зажигательные мелодии. День Святого Патрика – самый ирландский день в году, а Dance Irish станет самым ирландским местом в Москве, где частичку изумрудного острова привезут и покажут его лучшие представители! Узнать подробности вы можете в группе<a target=""_blank"" href=""https://vk.com/danceirish2018""> VK</a>."
Москва,500 — 1000,0+,,6 декабря 2015,156,35,Спектакль «Золушка и Кот в сапогах»,https://www.2do2go.ru/uploads/1b1f7f0965c3f6c4e50e56cff839c71d_w500_h500.jpg,
Москва,500 — 3000,12+,,10 марта 2014,157,35,Гала-концерт аргентинского танго,https://www.2do2go.ru/uploads/1282e9c009d5def818d7acb2b35c3dbe_w500_h500.jpg,
Москва,,0+,,14 марта 2020,158,36,Концерт «Тенистый путь Орфея»,https://www.2do2go.ru/uploads/eda26af4b3899a0fd0c6a305ead90cb3_w500_h500.jpeg," Название концерта «Тенистый путь Орфея» выбрано не случайно. Все помнят знаменитый миф о греческом герое, чья музыка завораживала людей, животных и птиц, богов и природу.   В рамках концерта гости услышат музыку Кристофа Виллибальда Глюка, который в соавторстве с Раньери де Кальцабиджи является автором оперы «Орфей и Эвредика». Также прозвучат композиции Бальдассаре Галуппи – композитора и капельмейстера Екатерины II, в чьем музыкальном творчестве нашли отражения мифы и сказания Древней Греции. Для любителей классического искусства подготовлены и отрывки из произведений французского композитора Николля Далейрака.   Музыка Кристофа, Виллибальда Глюка, Бальдассаре Галуппи, Николля Далейрака, как и творчество древнегреческого Орфея, на протяжении веков покоряла своей красотой, глубиной и изяществом. Музыкальные произведения исполнят лауреаты международных конкурсов Евангелина Чеславская (сопрано) и дуэт The Tribute в составе Юлии Шайнович (альт) и Софии Решетниковой (фортепиано). "
Москва,,0+,,10 марта 2020,159,36,Вернисаж «Путешествие в страну цветов»,https://www.2do2go.ru/uploads/2d964a35fb5a7e868b836c83400bb0a8_w500_h500.jpeg,"Вернисаж «Путешествие в страну цветов» – знакомство с флористическими коллажами, выполненными в различных декоративных техниках, стилях и жанрах. Организатор проекта – творческая студия «Цветочная мастерская» под руководством дизайнера-флориста Инны Свядосц. В коллекции «Цветочной мастерской» ТКС «Кунцево» – большое количество работ, созданных как профессиональными дизайнерами, так и любителями флористики. Ведь в студии флористического коллажа занимаются женщины всех возрастов и профессий, которые объединены огромной любовью к природе и увлечены творчеством.  Вернисаж «Путешествие в страну цветов» – красочная выставка коллажей, где участники «Цветочной мастерской» демонстрируют свое творчество, фантазию, художественный вкус и умение создавать удивительные картины из природных материалов."
Москва,,0+,,13 февраля 2020,160,36,Программа «Оперный концерт»,https://www.2do2go.ru/uploads/576e043bbbef524e8dd8c6c43b841481_w500_h500.jpeg," Опера – прима&nbsp;музыкального искусства. В канун Дня святого Валентина Клуб-галерея «Крылатский орнамент» приглашает соприкоснуться с оперным искусством. Подарком для всех москвичей станет оперный концерт Екатерины Черноусовой.   Екатерина Черноусова – вокалистка, композитор, пианистка, член Московского союза композиторов, артистка и солистка Президентского оркестра России, лауреат международных вокальных и музыкальных конкурсов, руководитель джаз-фьюжн группы. Екатерина имеет немало поклонников как в России, так и за рубежом, она – выпускница российско-американской программы «Открытый мир». Певица чарует своей открытостью, непринужденностью, легкостью, озорством и абсолютным профессионализмом.  На «Оперном концерте» в галерее «Крылатский орнамент»&nbsp;исполнительница непременно очарует гостей исполнением арий на музыку знаменитых композиторов, тонким музыкальным вкусом и ярким талантом. "
Москва,,0+,,7 февраля 2020,161,36,"Выставка «Плат, платок, платье»",https://www.2do2go.ru/uploads/6dd7f24756a79fe0c0f08217f3a39c9c_w500_h500.jpeg," Клуб-галерея приглашает всех желающих посетить выставку декоративно-прикладного искусства. Авторские платки, шали, палантины, косынки и платья – работы мастериц Московской городской творческой студии, клуба текстильного дизайна «Красный сарафан» под руководством Елены Вороновой.  Эта выставка – не просто уникальная экспозиция. Она формирует у детей и взрослых любовь и интерес к народным традициям в области декоративно-прикладного искусства, позволяет продемонстрировать работы в технике лоскутного шитья талантливых рукодельниц, сохранить традиционные ремесла.  "
Москва,,0+,,27 января 2020,162,36,Международная фотовыставка семейных фотографов #ЦВЕТ,https://www.2do2go.ru/uploads/8f56f828b10f7e19df6c737e37351407_w500_h500.jpeg,"Фотовыставка #ЦВЕТ от #MFamilia – это эмоции: радость, восторг, слезы, удивление, сопереживание, семейные истории и события, рассказанные лучшими семейными фотографами.   В выставке примут участие фотографы из Москвы, Санкт-Петербурга, Самары, Ростова-на-Дону, Краснодара, Чехова, Перми, Братска, Дмитрова, Севастополя, Ялта, Казахстана (Павлодар) и Германии (Гамбурга). Здесь вы увидите фотоработы Марии Романовой, Натальи Антипиной, Рашида Ахтямова, Вероники Безугловой, Елены Бирюковой, Светланы Стрижаковой, Саши Бунаевой, Анны Липатовой, Anya Soul и др. Приглашаются все желающие! "
Москва,,16+,,25 декабря 2019,163,37,Уроки рисования,https://www.2do2go.ru/uploads/9420a1e62484587ee971a58f2140436e_w500_h500.jpg,"Приглашаем раскрыть свой талант на уроках рисования с профессиональным художником Инной Тимохиной. Вы научитесь правильно держать кисть и карандаш, выстраивать цвет и композицию произведения, узнаете приёмы и способы получения объёмного изображения, попробуете себя в разных художественных техниках (акварель, пастель, цветные карандаши). С собой иметь бумагу для черчения или акварели (А3, плотность 200), простые карандаши и ластики. Предварительная запись по телефону 8-916-660-32-82 Инна. E-mail: anzer_95@mail.ru."
Москва,350,16+,,24 декабря 2019,164,37,Занятия йогой для взрослых,https://www.2do2go.ru/uploads/fc1ccf99af85b3327610cb5eb2e398d9_w500_h500.jpg,"Приходите на занятия йогой к Рите Пикалло. Рита преподает йогу более 15 лет. Её методика преподавания базируется на сочетании классического западного медицинского и психологического образования, системном изучении йоги у ведущих экспертов и принадлежности к традиционным индийским школам йоги и аюрведы. По образованию Рита медик и психолог. Она считает, что именно йога помогла ей &quot;познакомиться&quot; с собой, понять, что вести здоровый образ жизни, не перегружая понапрасну тело, ˗ это самый правильный путь. Вы можете выбрать направления: хатха-йога, йога -нидра, йога в темноте. Индивидуальный подход позволяет приступить к занятиям людям любого уровня подготовки, начиная с нулевого. Занятия строго по записи (тел: 8-916-8602810). Скидки льготным категориям. "
Москва,350,16+,,31 декабря 2019,165,37,Занятия йогой,https://www.2do2go.ru/uploads/fc1ccf99af85b3327610cb5eb2e398d9_w500_h500.jpg,"Если вы хотите познакомиться с различными направлениями йоги, приходите в Клуб имени Джерри Рубина на Ленинском. Хатха-йога, нидра-йога, йога в темноте, йога для спортсменов и не только. Занятия проводит опытный инструктор Рита Пикалло. Рита окончила факультет психологии в МГУ им. М.В. Ломоносова и имеет медицинское образование. Практикует и преподает йогу 15 лет. Занятия с Ритой – это непринуждённая обстановка, свобода и радость, это не только асаны, но и широкий спектр различных силовых упражнений на укрепление тела, балансы, растяжка. Ждем вас каждый вторник. За актуальным расписанием следите на странице клуба в VK и Facebook. Запись по телефону  8-916-8602810 https://m.vk.com/yoga_jerryrubin<br /> https://www.facebook.com/1563706200530500/posts/2532464956987948/<br /> <br /> <br /> <br />"
Москва,,0+,,6 апреля 2019,166,37,Выставка Аиды Лисенковой-Ханемайер,https://www.2do2go.ru/uploads/8e78bb9b061850dc82e60eba81cad195_w500_h500.jpg,"В рамках ежегодного народного фестиваля «Пора в космос» открывается выставка московской художницы Аиды Лисенковой-Ханемайер. В преддверии Дня авиации и космонавтики будут представлены картины, погружающие в неземные миры необъятной Вселенной. Сопровождать изобразительный ряд будет live-improvisation известных московских электронщиков, среди которых гуру электронной музыки Алексей Борисов и уникальная группа Schosha.Show. Зрители смогут увидеть ставшие уже визитной карточкой произведения Аиды, и совсем новые картины, выполненные в уникальной технике с использованием разных материалов. Среди них: «Рождение Земли» (1999), диптих «Солнечная Земля» и «Небесные сумерки» (2006), «Ценности земные и небесные» (2018). Узнать подробности вы можете на странице<a target=""_blank"" href=""https://www.facebook.com/groups/719893044764641/permalink/2148463981907533/""> FB</a>. <br />"
Москва,,0+,,30 марта 2019,167,37,Выставка Incredible India,https://www.2do2go.ru/uploads/0a3d095a1b2262a5c6ae30dcae33bf00_w500_h500.jpg,"30 марта в 17:00 состоится открытие фотовыставки Incredible India, фотограф – Елена@Zaychikovna. Формат мероприятия – уютная встреча единомышленников, увлеченных Индией, тех, кто уже безнадежно влюблен в эту удивительную страну и тех, кто только мечтает об индийских берегах. Вас ждет радушный прием Елены и ее indian stories, горячий чай масала, восточные сладости и свободный микрофон. Приглашенный гость – знаток Индии, вольная путешественница Ева Мира, 6 лет прожившая в этой стране и побывавшая в каждом её уголке.  Московский фотограф Елена@Zaychikovna – мастер портрета и репортажа. Поездка по индийскому штату Раджастан – это её первое знакомство с волшебной страной слонов и храмов, богов и героев.  Узнать подробности вы можете в группе<a target=""_blank"" href=""https://m.vk.com/jerryrubinclub?from=post""> VK</a> и на странице<a target=""_blank"" href=""https://www.facebook.com/groups/719893044764641/permalink/2144222615665003/""> FB</a>. "
Москва,,0+,,4 марта 2020,168,38,"Концертная программа «Для вас, любимые!»",https://www.2do2go.ru/uploads/5cd7e9ace69e74786e2a17296b6ccb85_w500_h500.jpeg,"Накануне праздника 8 Марта клубная система «Солнцево» организует концерт, в рамках которого зрителям подарят свое творчество лучшие коллективы района.  В этот вечер со сцены прозвучат тематические стихи и песни, будут исполнены яркие хореографические и вокальные номера. Для гостей выступят танцевальные коллективы: студия хип-хопа «Фоловей», студия «Лаборатория движения «ЗМ», театр танца «Журавлик», студия восточного танца «Нефертити», детские студии «Надежда» и «Танцевальная планета». Они представят номера «Сновидения природы», «Танец с зонтиками», «Утушка луговая», «Леди совершенство» и другие. На мероприятии также выступят солисты образцового вокального коллектива «Звуки музыки» – София Пирова, Василиса Савичева, Арут Григорян и Полина Шешокина.  Мероприятие проводится совместно с Региональной общественной организацией помощи многодетным, неполным и малоимущим семьям «Солнечные дети». На мероприятии с поздравлениями выступит Горбунова Светлана Вячеславовна – президент РОО «Солнечные дети»."
Москва,,0+,,19 февраля 2020,169,38,Концертная программа «Защитникам – слава!»,https://www.2do2go.ru/uploads/cf2a282e56d65d2ba135639a616ade87_w500_h500.jpeg,
