town,price,age,site_buy,date,id,id_cultural,name,img_url,content
Москва,12500,6+,https://v-v-v.ru/summer_shift/programma-teatr/,28 августа 2020,0,0,Программа «Летняя творческая резиденция. Театр»,https://www.2do2go.ru/uploads/df8f99730b8b82f75a85ef1efe9c88fd_w500_h500.jpeg,"Каждый ребенок – неутомимый исследователь! Пять творческих резиденций погрузят детей в разные культурные контексты: танец, театр, арт, наука и история. В августе в культурном центре «Вдохновение» юные исследователи смогут открыть для себя много нового в команде единомышленников. Программа «Театр» – многогранная, сложная и увлекательная жизнь, которая не ограничивается сценой. Самое интересное происходит за кулисами. Основы сценического движения и речи, изготовление реквизита, навыки актёрского мастерства, а также беседы о стилях, эпохах, видах театра...  Подробную информацию можно узнать по <a target=""_blank"" href=""https://v-v-v.ru/summer_shift/programma-teatr/"">ссылке</a>."
Москва,12500,6+,https://v-v-v.ru/summer_shift/programma-tanec-2/,28 августа 2020,1,0,Программа «Летняя творческая резиденция. Танец»,https://www.2do2go.ru/uploads/589a909628e127e4ff08c0a23b2cd610_w500_h500.jpeg,"Каждый ребенок – неутомимый исследователь! Пять творческих резиденций погрузят детей в разные культурные контексты: танец, театр, арт, наука и история. В августе в культурном центре «Вдохновение» юные исследователи смогут открыть для себя много нового в команде единомышленников.  «Танец» – программа современных направлений в танце: хип-хоп, брейк, джем, дэнсхолл, диско, латина, джаз-фанк. За две недели ребёнок изучит танцевальные связки. Но это верхушка айсберга, а под ней – ежедневная работа по физической подготовке: акробатика, гимнастика, постановка трюков. А в перерывах между танцами ребята будут развивать коммуникативные навыки, укреплять связи внутри команды и учиться доверять партнёрам. Подробную информацию можно узнать по <strong><a target=""_blank"" href=""https://v-v-v.ru/summer_shift/programma-tanec-2/"" target=""_blank"">ссылке</a></strong>."
Москва,12500,6+,https://v-v-v.ru/summer_shift/programma-nauka/,28 августа 2020,2,0,Программа «Летняя творческая резиденция. Наука»,https://www.2do2go.ru/uploads/142091879616ae7514c10ddb176c4a6e_w500_h500.jpeg,"Каждый ребенок – неутомимый исследователь! Пять творческих резиденций погрузят детей в разные культурные контексты: танец, театр, арт, наука и история. В августе в культурном центре «Вдохновение» юные исследователи смогут открыть для себя много нового в команде единомышленников. «Наука» – любопытство не грех, а двигатель науки. В рамках программы ребята будут развивать научное мышление, искать ответы на вопросы, изобретать приборы и ставить эксперименты. Кураторы смены научат анализировать информацию, ставить цели, планировать задачи и принимать решения.  Подробную информацию можно узнать по<strong> <a target=""_blank"" href=""https://v-v-v.ru/summer_shift/programma-nauka/"" target=""_blank"">ссылке</a></strong>."
Москва,12500,6+,https://v-v-v.ru/summer_shift/programma-art/,14 августа 2020,3,0,Программа «Летняя творческая резиденция. Арт»,https://www.2do2go.ru/uploads/5dd964d619f6b6b62eca1fdcfad04d04_w500_h500.jpeg,"Каждый ребенок – неутомимый исследователь! Пять творческих резиденций погрузят детей в разные культурные контексты: танец, театр, арт, наука и история. В августе в культурном центре «Вдохновение» юные исследователи смогут открыть для себя много нового в команде единомышленников. Программа «Арт» – это место и время для творческих людей, в котором они воплощают в реальность свои мечты. На смене дети выражают себя через холсты и краски, учатся работать с цветом, текстурами и формами, развивают воображение, раскрывают творческий потенциал. На арт-смене дети познакомятся с искусством скульптуры, рисованием в различных техниках, дизайном одежды, создадут коллажи и свои первые плакаты в стиле леттеринг. Подробную информацию можно узнать по <a target=""_blank"" href=""https://v-v-v.ru/summer_shift/programma-art/"">ссылке</a>."
Москва,12500,6+,https://v-v-v.ru/summer_shift/programma-tanec/,14 августа 2020,4,0,Программа «Летняя творческая резиденция. Танец»,https://www.2do2go.ru/uploads/867f2d34ce40f6acb7334a3152152156_w500_h500.jpeg,"Каждый ребенок – неутомимый исследователь! Пять творческих резиденций погрузят детей в разные культурные контексты: танец, театр, арт, наука и история. В августе в Культурном центре «Вдохновение» юные исследователи смогут открыть для себя много нового в команде единомышленников.  Вас ждет программа современных направлений в танце: хип-хоп, брейк, джем, дэнсхолл, диско, джаз-фанк. За две недели ребенок изучит танцевальные связки. Но это верхушка айсберга, а под ней – ежедневная работа по физической подготовке: акробатика, гимнастика, постановка трюков. А в перерывах между танцами вы будете развивать коммуникативные навыки, укреплять связи внутри команды и учиться доверять партнерам. Подробную информацию вы можете узнать <a target=""_blank"" href=""https://v-v-v.ru/summer_shift/programma-tanec/"" target=""_blank"">на сайте</a>."
Москва,,6+,,10 октября 2019,5,1,Всемирный день психического здоровья,https://www.2do2go.ru/uploads/bfc468ea41850a29f56df74255246096_w500_h500.jpg,"Ежегодно 10 октября при поддержке ВОЗ в мире отмечается День психического здоровья. Его цель – повысить информированность всех слоев населения в вопросах профилактики и лечения психических расстройств и заболеваний. Задача – обеспечить популяризацию и доступность психиатрической помощи, найти пути преодоления такого явления как стигматизация психиатрии. Специалисты столичной психиатрической службы приглашают москвичей 10 октября на общегородское мероприятие, посвященное празднованию Всемирного дня психического здоровья. Здесь вы познакомитесь с самыми интересными проектами в области психопрофилактики и психопросвещения, такими как «Сказать не могу молчать», «Только без паники», «Рацион жизни», «Клиника памяти» и другими. В этот день в уникальном пространстве конгрессно-выставочного центра «Дом на Брестской» опытные врачи и психологи известных московских специализированных клиник ответят на все ваши вопросы. В течение дня для гостей будет доступна анонимная и бесплатная консультативная помощь психологов, психотерапевтов, психиатров. Также гости смогут увидеть театральный перфоманс, посетить увлекательные мастер-классы по арт-терапии. Здесь будет настоящая территория творчества! Узнать подробности вы можете в группе <a target=""_blank"" href=""https://vk.com/pkb1alekseeva"">VK</a>."
Москва,,12+,,11 сентября 2016,6,1,"Экскурсия «Высотки, вокзалы и промзоны Москвы»",https://www.2do2go.ru/uploads/db7ea28ca552c02955a5981437d248fd_w500_h500.jpg,"Самыми удивительными и, пожалуй, загадочными достопримечательностями столицы по-прежнему остаются сталинские высотки. Участники автобусного маршрута проедут мимо домов на Котельнической набережной, здания МИДа, сделают остановку возле гостиницы «Украина» и МГУ им. Ломоносова. А экскурсовод расскажет об истории их строительства. Записаться на экскурсию можно по <a target=""_blank"" href=""pogоdinka12@mail.ru"">электронной почте</a>.  Участникам экскурсии на Комсомольской площади гид расскажет о судьбе Ярославского, Казанского и Ленинградского вокзалов. Кроме того, речь пойдет о том, по какому графику работали вокзалы сто лет назад и как строили первую железную дорогу между Москвой и  Петербургом. Регистрация — по телефону +7 (495) 680-07-50. Третья экскурсия будет посвящена индустриальным зонам столицы. На ней расскажут об индустриальном развитии города на примере таких проектов , как «ЗИЛ», «Серп и Молот» и «Южный порт». Для посещения, необходимо заранее зарегистрироваться на <a target=""_blank"" href=""http://www.dom6.ru/"">сайте</a>. Подробнее — на <a target=""_blank"" href=""https://www.mos.ru/news/item/15444073"">сайте</a>."
Москва,,12+,,30 сентября 2013,7,1,Проект «Забор. Архитектура и философия пространства «Между»,https://www.2do2go.ru/uploads/9ff09f33f58ca424df5916b7b2f87d6f_w500_h500.jpg,
Москва,,12+,,30 апреля 2020,8,2,Выставка «Разрезая стены»,https://www.2do2go.ru/uploads/902931e92d01669560835d6dc96ec273_w500_h500.jpg,"Персональная выставка Игоря Поносова «Разрезая стены» обобщает многолетний опыт работы и взаимодействия художника с объектами городской среды. Вдохновляясь брутальными архитектурными формами и несуразным сочетанием материалов на улицах (рекламные баннеры, фальшфасады), Игорь Поносов осмысляет рутинную повседневность города посредством своих мимикрий и интервенций, имеющих ярко выраженный перформативный характер.  В экспозицию включены фото- и видеодокументации взаимодействий с городской средой, а также графика, коллажи и фотографии, отражающие осмысление городских контекстов России, Германии и Эстонии. Представленные на выставке работы выполнены автором в период с 2015 по 2020 годы и объединены общей темой поглощения человека современной урбанизированной средой. Узнать подробности вы можете на <a target=""_blank"" href=""http://fabrikacci.ru/razrezaya-steny-personalnaya-vystavk/"">сайте.</a><br />"
Москва,,6+,https://fabrika-events.timepad.ru/event/1266160/,29 марта 2020,9,2,Выставка «Живопись минус»,https://www.2do2go.ru/uploads/735a328ea3340c62be8fc5b07ebdf070_w500_h500.jpg,"Марат Гельман снова обращает внимание на бывшую «царицу искусств» и показывает работы художников, сознательно обращающихся к живописи и обедняющих свой традиционный художественный язык. Под названием «Живопись минус» куратор понимает сопротивление салону с одной стороны и стремление удержаться от дизайнерского подхода и минималистского искусства с другой стороны: «К 2020 году, когда многие технологии достигли совершенства, жидкокристаллические экраны и мощные проекторы преображают выставочное пространство, когда вокруг разговоры об искусственном интеллекте, и мир в ожидании сингулярности, в Москве вдруг обнаружилось много таких «диссидентов дизайна», упорно ищущих в живописи минус – новые возможности для художественного высказывания».  <b>Художники</b>: Семен Агроскин, Виктор Алимпиев, Юрий Альберт, Алладин Гарунов, Аня Желудь, Людмила Константинова, Анна, Егармина, Земляникина, Иван Лунгин, Иван Новиков, Вика Шумская, Хаим Сокол, Александр Сигутин, Виктор Фрейденберг.  Открытие 5 марта в 19:00. Подробнсоти – на <a target=""_blank"" href=""http://fabrikacci.ru/novyy-kuratorskiy-proekt-marata-gel/"">сайте</a>."
Москва,,0+,,31 января 2020,10,2,День рождения «Фабрики»,https://www.2do2go.ru/uploads/1a65dc11254622dffc7b0de4a1d94f03_w500_h500.jpg,"Праздник начнется с открытия новых выставок: в зале «Оливье» и «Артхаус» проекты представят Александра Кузнецова и Лиза Ольшанская. Художницы покажут работы, которые создали в фабричных мастерских в 2019 году. В Цехе Отделки состоится открытие выставки Юлии Неронска «Тайная жизнь ковра-самолёта». Юлия создаст инсталляцию и покажет серию фотографий, образующих сюжетное искусство, в котором настенный ковёр становится самобытным персонажем. В зале «Оливье» в 20:00 пройдет объявление лауреатов программы «Фабричные мастерские. Сессия VII» – конкурса для художников от 35 до 50 лет. Ставший уже традиционным для «Фабрики» проект в 2020 году также празднует день рождения – уже пять лет, начиная с 2015 года, сессионная часть конкурса обеспечивает поддержкой российских mid-career artist. Экспертный совет каждый год отбирает лауреатов в нескольких номинациях, предоставляя возможность получить мастерскую, показать персональную выставку и напечатать свои работы в студии «Пиранези LAB». Узнать подробности вы можете на<a target=""_blank"" href=""https://fabrika-events.timepad.ru/event/1238952/""> сайте</a>."
Москва,,16+,,19 января 2020,11,2,Выставка «Скрытый контент»,https://www.2do2go.ru/uploads/a04f6b92d240df154d4970666e7c93cc_w500_h500.jpg,"Конец года – традиционное время подведения итогов, и, пожалуй, самое подходящее для демонстрации проекта «Скрытый контент»: художник Степан Краснов подводит итоги в живописной форме.<br /> «Скрытый контент» – это иллюстрация повседневности, в которой мы всё чаще сталкиваемся с цензурой, через метафорическую призму неопуантилизма. Запреты концертов и фильмов, разгоны мирных митингов и показательные уголовные преследования их участников. За нас пытаются решить, какую музыку слушать и какие фильмы смотреть, какую информацию нам можно потреблять, а какую скрывать. Неопуантилизм, в стилистике которого выполнена серия, определенным образом кодирует изображения, смещая фокус восприятия. Размывая какие-то важные моменты, делая их менее заметными. Тем не менее нам удаётся считать нарратив живописных работ. Таким же образом происходит ориентирование в информационном поле. Узнать подробности вы можете на <a target=""_blank"" href=""https://fabrika-events.timepad.ru/event/1217312/"">сайте</a>."
Москва,,6+,https://fabrika-events.timepad.ru/event/1211968/,8 января 2020,12,2,Выставка «Дым и шоколад»,https://www.2do2go.ru/uploads/6e24684c7badaa9aa620db8f1a531c7c_w500_h500.jpg,"В 2018 году группа «Войти и разрешить» приняла участие в проекте, который проходил в Кенозерском национальном парке, вместе со шведской группой Raketa: «Мы оказались в непонятной ситуации, когда мы не понимали, кто мы по отношению к группе, к местным жителям, к природе». На выставке исследователи хотят обозначить свою позицию, найти себя в системе координат по отношению к той ситуации, в которой оказались.  Через обозначение важных для них мест, схематизацию опыта группа хочет уйти от представления севера как красивых пейзажей и обратиться к тому, что происходит внутри: к «бесхозности» местных жителей, оказавшихся после закрытия лесосплава под управлением заповедника, к ненужности прошлого, которое хранится в ящиках на чердаках домов, к себе как чужакам, приехавшим, чтобы делать что-то, даже не понимая что, и существующих в выдуманном пространстве, никак не соотносящимся с реальной ситуацией. Участники: Анна Козловская, Татьяна Миронова, Наталья Смолянская, Дима Филиппов. Узнать подробности вы можете на <a target=""_blank"" href=""http://fabrikacci.ru/dym-i-shokolad/"">сайте.</a>"
Москва,,12+,,28 апреля 2020,13,3,Лекции проекта «Страноведение. Турция»,https://www.2do2go.ru/uploads/886ad52fa8329b7e53bfd430f050b55f_w500_h500.jpg,"Вместе с молодыми исследователями гости погрузятся в удивительное культурное разнообразие стран и народов планеты. Первая точка на карте – многогранная, знакомая и незнакомая Турция. Программа: Ведущие – студенты Института стран Азии и Африки МГУ им. М. В. Ломоносова Мария Гибаева, Мария Лаврова и Полина Ардашова.  Для участия в лекциях необходимо пройти <a target=""_blank"" href=""https://vorobievygory-events.timepad.ru/event/1269988/"">предварительную регистрацию</a>. <a target=""_blank"" href=""https://vg.mskobr.ru/novosti/moskovskij_dvorec_pionerov_priglashaet_na_lekcii_po_stranovedeniyu/"">Официальный сайт ГБПОУ «Воробьёвы горы»</a>."
