town,price,age,site_buy,date,id,id_cultural,name,img_url,content
Москва,,0+,,20 апреля 2019,302,69,Литературно-музыкальная программа «На ярмарке литературных героев Гоголя»,https://www.2do2go.ru/uploads/866f593548660efd5b49cbbe41827914_w500_h500.jpg,"20 апреля библиотека культурного центра «Внуково» приглашает на литературно-музыкальную программу «На ярмарке литературных героев Гоголя», в рамках ежегодной всероссийской акции «Библионочь».  Детская программа начнется в 19:00 просмотром мультфильма по произведению Н. В. Гоголя «Ночь перед Рождеством», затем юным читателям предоставится возможность стать актерами и сыграть любого героя знаменитого произведения. Постановка театрального этюда пройдет под руководством актрисы, режиссера Ирины Луквониковой и займет не более 7 минут.  В 20:00 для любителей искусства и литературы пройдет беседа «Гоголь в картине Александра Иванова «Явление Христа народу», а в 20:20 пройдет показ театральной постановки пластической театральной студии «Вдохновение» (рук. И. Луковникова) «Поппури гоголевских героев».  В 2019 года отмечается 210 лет со дня рождения Николая Васильевича Гоголя. Гоголь – русский прозаик, драматург, поэт, критик, публицист, признанный одним из классиков русской литературы."
Москва,200 — 1200,0+,http://www.newballet.ru,12 октября 2019,303,69,Балет «Удивительный сон»,https://www.2do2go.ru/uploads/a1b66d4bdc562ca6f1df8270f950e07b_w500_h500.jpg,"Балет для детей «Удивительный сон» –&nbsp;постановка молодого хореографа Александра Могилева, победителя шоу «Танцуй» на Первом канале. Это красивая хореографическая фантазия по произведениям всеми любимого Г.-Х. Андерсена «Оле-Лукое». Живая, эмоциональная сказка, занимательный сюжет – все симпатии автора постановки безраздельно отданы юному герою, отправляющемуся в необычайное путешествие в страну сновидений.  История о мальчике, который засыпает под дедушкины рассказы и отправляется в путешествие по дням недели. Там он помогает друзьям преодолеть коварство и колдовство злодеев. Здесь ему предстоит научиться быть внимательным к большому миру и его тайнам, другим людям и странным событиям. Как в любой сказке, дело, конечно, не обходится без волшебства, ведь с ним вместе непременная спутница хороших детей – добрая волшебница прекрасная фея. Музыка группы Sunny from the Moon, трогательные и прелестные персонажи, красочные костюмы не оставят равнодушными ни детей, ни родителей."
Москва,,12+,,3 ноября 2019,304,70,Ночь искусств «Волшебный мир искусства»,https://www.2do2go.ru/uploads/2c1a50778853d345e08bdb1e899dec35_w500_h500.jpeg,"Седьмая ежегодная культурно-образовательная акция «Ночь искусств» пройдет в виде квеста по Дому культуры «Юбилейный». В квесте примут участие ученики 7–10 классов (четыре команды по 6 человек). Квест пройдет в несколько этапов.  В библиотеке пройдет игра «Что? Где? Когда?», ребятам надо будет ответить на большее количество вопросов о литературе. В дискотечном зале пройдет игра «Угадай мелодию». В зрительном зале будут соревноваться капитаны команд – игра «Большой вопрос» (отвечать можно на вопросы правильно или смешно).  Затем пройдет «Конкурс болельщиков» – болельщикам нужно будет охарактеризовать свою команду стихотворением. За каждый правильный ответ на протяжении всего квеста команды будут получать смайлики-буквы, из которых в последствии нужно будет составить высказывание знаменитого человека. Победит та команда, которая наберет большее количество смайликов и первая соберет высказывание."
Москва,,12+,,4 ноября 2018,305,70,Ночь искусств в доме культуры «Юбилейный»,https://www.2do2go.ru/uploads/a8139c086ac5aa9aca7088662e39ca37_w500_h500.jpg,"В прошлом, как водится, и трава была зеленее, и мороженое вкуснее, и страна великой, единой и могучей. Прошлое не возвращается, но можно ненадолго окунуться в атмосферу прошлого во время вечеринки, организованной в стиле СССР. Заброшенный клуб, на стене голова Ленина, на столе печатная машинка с незаконченным сценарием, рояль с пыльными клавишами, а из проигрывателя звучит музыка. Но что могло случится, почему люди покинули клуб, не доделав свою работу. Именно эту загадку придется разгадать участникам мероприятия.  Участники по 4–6 человек попадают на квест. Вернуться они смогут только после решения разных головоломок, в результате чего, благодаря подсказкам, найдут ключ. Результат игры непредсказуем, так как каждый участник может повести себя не так, как было запланировано по сценарию, исходя из способностей и обстоятельств. <b>Другие события в рамках акции «Ночь искусств»</b>"
Москва,,0+,,21 мая 2016,306,70,Ночь музеев: «Грандиозная памятная книга человечества»,https://www.2do2go.ru/uploads/068b12b67b33ee97763ec50201340640_w500_h500.jpeg,
Москва,,12+,,3 ноября 2019,307,71,Творческая встреча «Союз»,https://www.2do2go.ru/uploads/31b0c5aaa41f2b7c825dc339f84f1525_w500_h500.jpeg,"В Центре культуры и творчества «Нега» состоится творческая встреча «Союз», которая пройдет в рамках ежегодной общегородской акции «Ночь искусств». Писатели, художники, вокалисты и артисты, а также постоянные друзья центра представят вниманию гостей свои авторские работы.  Литературный вечер пройдет в формате открытого микрофона. Все гости центра смогут прочитать свои произведения и стихотворения, спеть песню или рассказать о себе. В творческой непринужденной обстановке гости центра и участники вечера смогут познакомиться с интересными личностями, обменяться контактами и завязать новые интересные знакомства, которые в дальнейшем могут привести к творческому союзу, что и является целью вечера."
Москва,,12+,,20 апреля 2019,308,71,Библионочь в центре культуры и творчества «Нега»,https://www.2do2go.ru/uploads/c33ee18f13da1b20a1ebcb62e52e4acc_w500_h500.jpg,"20 апреля в стране состоится акция «Библионочь»! Цель столь масштабной акции – проведение таких тематических мероприятий, как открытые чтения, книжные ярмарки, мастер-классы и многое другое. В ЦКТ «Нега» пройдет «Библионочной книгообмен».  В течение всего дня можно будет обмениваться самыми любимыми своими произведениями, а в 18:00 посетителей ждет открытый «чтецкий микрофон». А также полюбившиеся зрителю Olen &amp; Agatha, уже не первый раз выйдут на подмостки сцены. Музыкально-поэтическая мистерия, соединяющая человека с небом, поэзия и музыка, их взаимосвязь и взаимопроникновение, существование в потоке здесь и сейчас вместе со зрителем.  Георгий Аветисян и Ирина Чаплыгина представят литературно-музыкальную композицию «Ниоткуда с любовью» на стихи И. Бродского."
Москва,,6+,,25 августа 2018,309,71,Ночь кино в Центре культуры и творчества «Нега»,https://www.2do2go.ru/uploads/97a2e8851563210d2931034d9fde551d_w500_h500.jpg,"Кинопоказ состоится в рамках Всероссийской акции «Ночь кино – 2018». Каждый желающий может прийти и посмотреть приключенческий мультфильм «Тайна третьей планеты».<br /> Мир, созданный писателем-фантастом Киром Булычевым, полюбился многим поколениям. Опасное путешествие маленькой девочки по открытому космосу и сегодня привлекает зрителей.  После просмотра пройдет обсуждение, каждый сможет выразить свои чувства. Никто не останется равнодушным и получит массу удовольствия. <br />"
Москва,,6+,,27 апреля 2017,310,71,Книга джунглей,https://www.2do2go.ru/uploads/cf3335a7f4b782c118e216c1bc712d28_w500_h500.jpg,"27 апреля, в 18:00 состоится премьера! Отделение современной хореографии Школы танца «Акцент» ЦКТ «Нега» подготовило ко Дню танца танцевальный спектакль «Книга джунглей». Премьерное представление – это история в танце, которая расскажет о роли маленького человека в большом и не всегда приветливом мире, о силе духа, чести и, конечно, о дружбе. Это не просто воплощение на сцене одноимённого произведения Редьярда Киплинга, но собственная история, рассказанная юными исполнителями с их неповторимым характером и индивидуальным мировоззрением. Мероприятие рассчитано на зрителя старше 5 лет. Вход свободный. В Центре культуры действует режим сменной обуви.<br />"
Москва,,12+,,16 марта 2017,311,71,Программа «Я очень люблю Родину...»,https://www.2do2go.ru/uploads/eac437ca62e064af3ead6383e4fd03b8_w500_h500.jpg,"Дорогие друзья! Центр культуры и творчества «Нега» и Есенинская литературно-музыкальная гостиная приглашают вас на вечер, посвящённый памяти русских поэтов «Я очень люблю Родину...». В программе принимают участие: Юлия Чиркова-Троицкая, Евгений Карунин, Андрей Чирков и др. Прозвучат стихи и песни на стихотворения и произведения Сергея Есенина, Николая Рубцова, Игоря Талькова и авторские песни, посвящённые России. Уютная атмосфера, добрая компания, а также звуки музыки и слова гарантированы! В ЦКТ «Нега» действует режим сменной обуви."
Москва,,6+,,3 ноября 2019,312,72,Закрытие фестиваля «Радуга детства»,https://www.2do2go.ru/uploads/c6da512e91f24c13a325a278a9f87f91_w500_h500.jpeg,"С 27 октября по 3 ноября в КЦ «Рублево» пройдет Всероссийский фестиваль «Радуга детства», в котором примут участие театральные коллективы из разных городов нашей страны. Зрители разных возрастов придут на спектакли этих коллективов, чтобы встретиться с любимыми сказочными героями, увидеть героев незнакомых театральных постановок, поделиться впечатлениями об увиденном с друзьями и, конечно, получить приз, ведь зрители, посетившие десять спектаклей, уходят с церемонии награждения с призами оргкомитета фестиваля!  В рамках общегородской акции «Ночь искусств» 3 ноября пройдет торжественное закрытие фестиваля и церемония награждения: коллективы-победители получат дипломы и призы оргкомитета фестиваля, отдельным театральным коллективам будут вручены специальные призы в разных номинациях. Кроме призов за посещение десяти спектаклей, среди зрителей разыгрывают суперпризы фестиваля! Также перед зрителями выступит коллектив Театра игры «Надежда» КЦ «Рублево» со спектаклем «Сказки-наоборотки»."
Москва,,0+,,20 мая 2019,313,72,Выставка «Окраина»,https://www.2do2go.ru/uploads/abf45d8b661cdbd9138893234fd301db_w500_h500.jpg,"Окраина – это не просто топографическое понятие, это явление, вмещающее в себя образные приметы времени и места.  Выполняя пограничную функцию между центром города и расстилающимися за городскими пределами бескрайними просторами, окраина соединяет в себе свойства этих двух стихий. Конфликт, основанный на взаимоотношении природы и урбанистической среды, проявляется здесь наиболее остро.  На выставке будут представлены более 30 живописных и графических работ Ирины Богдановой, Анны Бриллинг, Инны Вольвак, Ивана Дедка, Милы Гавриловой, Елены Гагариной, Юрия Царевского и Андрея Шатилова.  Подробности – на&nbsp;<a target=""_blank"" href=""www.artcultivator.ru"" target=""_blank"">сайте</a>."
Москва,,0+,,1 июня 2017,314,72,Рублёвская палитра,https://www.2do2go.ru/uploads/f17ef511e67e5a97487cc8f19bf84515_w500_h500.jpg,"Дети до 8 лет представят на конкурс свои творческие работы по тематике: 130-летие со дня рождения С. Я. Маршака. Ребятам от 9 до 16 лет предстоит отразить проблему терроризма в современном мире. Цель конкурса – способствовать развитию творческих способностей у детей, формировать бережное отношение к истории и культуре своего народа. Принять участие в конкурсе может любой желающий из любой страны в возрасте до 16 лет. В конкурсе две номинации по четырем возрастным категориям: 1. Номинация «Изобразительное искусство»: 2. Номинация «Декоративно-прикладное искусство»: «Рублёвская палитра-2017» пройдет в два этапа. Первый этап уже стартовал 1 февраля, регистрация заявок продолжится до 15 мая. Второй этап пройдет с 15 по 31 мая – отбор лучших работ. Церемония награждения победителей состоится open-air 1 июня 2017 г."
Москва,,0+,,20 мая 2017,315,72,Ночь в музее в КЦ «Рублево»,https://www.2do2go.ru/uploads/b9447aad28379832363671b81fa01965_w500_h500.jpg,"В рамках акции «Ночь в музее» в фойе первого этажа культурного центра «Рублево» пройдёт выставка работ Марианны Грозовой «Я люблю».   Марианна Грозова является действительным членом Академии народного искусства и членом Союза художников народного искусства. Живописные работы Марианны удивительны, в них столько тепла и нежности, что с первых мгновений зритель наполняется покоем и радостью созерцания. Выставка станет подарком истинным ценителям прекрасного, ведь встреча с настоящим искусством - всегда праздник.   Целевая аудитория мероприятия – дети дошкольного и школьного возрастов, молодежь, студенты, взрослые, люди старшего поколения. Цель мероприятия – участие культурного центра в общегородской акции «Ночь в музее». Помощником в организации и проведении выставки будет штатный художник культурного центра – Жеденко Наталья Александровна."
Москва,,0+,,20 мая 2017,316,72,Весенний мотовернисаж,https://www.2do2go.ru/uploads/14499cea235254c29bf68a8926e278ea_w500_h500.jpg,"Для участия в выставке не обязательно быть профессиональным реставратором или коллекционером авто-, мототехники. Ведь, зачастую, у многих в гараже есть один или даже несколько старых аппаратов, которые были с любовью восстановлены, что называется, для себя. Однако, как правило, их продемонстрировать негде, кроме как показать родным и друзьям. Ретро-фестиваль как раз ставит своей целью предоставить возможность таким людям, чтоб показать всем плоды своих трудов, сравнить свои творения с другими и познакомить молодежь с «историей» отечественной автомобильной и мотоциклетной промышленности. Но это не говорит, о том, что на мотовернисаже не ждут профессионалов: кастом-ателье и мотосервисы.  Участие в фестивале для всех бесплатное. Каждый участник получит диплом, и среди них будет разыграно несколько подарков. Все, что вам требуется – это заполнить заявку на сайте российского <a target=""_blank"" href=""http://www.rrmk.ru/questionary"" target=""_blank"">мотоклуба </a>«Русский рассвет МК» и приехать на «Весенний мотовернисаж»."
Москва,,12+,,3 ноября 2019,317,73,Спектакль «Провинциалка»,https://www.2do2go.ru/uploads/b263218c3b4c36950e27da6541701da7_w500_h500.png,"Все начинается как обычная репетиция классической пьесы Тургенева «Провинциалка». Актеры читают свои роли, вживаются в образы. Но вот уже Дарье Ивановне и кухарке Васильевне становится тесно на одной сцене. Постепенно актеры переодеваются в костюмы той эпохи, появляются декорации. В итоге вся пьеса будет показана зрителю, но какой ценой?  Данная постановка начиналась как шутка и зарисовка для фестиваля в рамках акции «Ночь в библиотеке». Но в итоге переросла в самостоятельный спектакль, который удобно перевозить на гастроли. Если вы неравнодушны к театральной сцене и закулисью, обязательно познакомьтесь героями! Спектакль состоится в рамках всероссийской акции «Ночь искусств»."
